{"place": {"town": "edgecombe-county", "district_short_name": "R-30", "district_full_name": "Single-Family Residential"}, "eval_term": "max_height", "llm_outputs": [{"place": {"town": "edgecombe-county", "district_short_name": "R-30", "district_full_name": "Single-Family Residential"}, "eval_term": "max_height", "raw_model_response": "Based on the provided information, I could not find a specific maximum height value for the Single-Family Residential (R-30) district. The dimensional requirements table on page 169-170 lists the \"Maximum Building Height (feet)\" for residential development in the R-30 district as 35 feet. Therefore, the answer is:\n\n{\n    \"extracted_text\": [[\"Maximum Building Height (feet)\\nResidential Development\\n35\", 170]],\n    \"rationale\": \"The dimensional requirements table for the R-30 Single-Family Residential district explicitly states the maximum building height for residential development is 35 feet.\",\n    \"answer\": \"35 ft\"\n}", "extracted_text": [["Maximum Building Height (feet)\nResidential Development\n35", 170]], "rationale": "The dimensional requirements table for the R-30 Single-Family Residential district explicitly states the maximum building height for residential development is 35 feet.", "answer": "35 ft"}]}