{"place": {"town": "edgecombe-county", "district_short_name": "M-2", "district_full_name": "General Industrial"}, "eval_term": "max_height", "llm_outputs": [{"place": {"town": "edgecombe-county", "district_short_name": "M-2", "district_full_name": "General Industrial"}, "eval_term": "max_height", "raw_model_response": "Based on the information provided in the input, I could not find a specific maximum height value for the General Industrial (M-2) district. The relevant section states:\n\n\"Maximum Building Height (feet)\nNon-Residential Uses: No Maximum\"\n\nTherefore, I cannot provide a specific numeric answer for the max_height of the General Industrial (M-2) district. The ordinance does not specify a maximum height limit for this district.\n\n{\n    \"extracted_text\": [[\"Maximum Building Height (feet)\\nNon-Residential Uses: No Maximum\", 147]],\n    \"rationale\": \"The table of dimensional requirements for the M-2 (General Industrial) district explicitly states there is no maximum building height for non-residential uses in this district.\",\n    \"answer\": null\n}", "extracted_text": [["Maximum Building Height (feet)\nNon-Residential Uses: No Maximum", 147]], "rationale": "The table of dimensional requirements for the M-2 (General Industrial) district explicitly states there is no maximum building height for non-residential uses in this district.", "answer": null}]}