{"place": {"town": "dunn", "district_short_name": "C-1", "district_full_name": "Central Commercial"}, "eval_term": "max_height", "llm_outputs": [{"place": {"town": "dunn", "district_short_name": "C-1", "district_full_name": "Central Commercial"}, "eval_term": "max_height", "raw_model_response": "Based on the information provided in the input, here is the relevant information about the maximum building height for the C-1 (Central Commercial) zoning district:\n\n{\n    \"extracted_text\": [[\"CELL (22, 8): 50 ft [4]\", 57]],\n    \"rationale\": \"The table on page 57 shows the maximum building height for the C-1 zoning district as 50 ft, with a note [4] attached.\",\n    \"answer\": \"50 ft\"\n}\n\nThe table on page 57 provides dimensional standards for different zoning districts, and for the C-1 district it specifies a maximum building height of 50 ft. There is a note [4] attached, but the content of that note is not provided in the given text. The 50 ft height limit appears to be the most definitive answer based on the information available in the input.", "extracted_text": [["CELL (22, 8): 50 ft [4]", 57]], "rationale": "The table on page 57 shows the maximum building height for the C-1 zoning district as 50 ft, with a note [4] attached.", "answer": "50 ft"}]}