{"place": {"town": "coats", "district_short_name": "HIO", "district_full_name": "Heavy Industry Overlay"}, "eval_term": "max_height", "llm_outputs": [{"place": {"town": "coats", "district_short_name": "HIO", "district_full_name": "Heavy Industry Overlay"}, "eval_term": "max_height", "raw_model_response": "Based on the provided input, here is the relevant information about the max_height for the Heavy Industry Overlay (HIO) district:\n\n{\n    \"extracted_text\": [[\"(1.) The maximum building height for a structure adjacent to a residential or\\ncommercial zoning district shall be no greater than 40 feet.\\n(2.) The maximum building height for a structure adjacent to an industrial zoning\\ndistrict - no height restrictions.\", 163]],\n    \"rationale\": \"The section explicitly states the maximum building height requirements for the Heavy Industry Overlay (HIO) district. It provides two different height limits depending on the adjacent zoning.\",\n    \"answer\": \"40 ft for structures adjacent to residential or commercial zoning; no height restrictions for structures adjacent to industrial zoning\"\n}", "extracted_text": [["(1.) The maximum building height for a structure adjacent to a residential or\ncommercial zoning district shall be no greater than 40 feet.\n(2.) The maximum building height for a structure adjacent to an industrial zoning\ndistrict - no height restrictions.", 163]], "rationale": "The section explicitly states the maximum building height requirements for the Heavy Industry Overlay (HIO) district. It provides two different height limits depending on the adjacent zoning.", "answer": "40 ft for structures adjacent to residential or commercial zoning; no height restrictions for structures adjacent to industrial zoning"}]}