{"place": {"town": "dobson", "district_short_name": "R-S", "district_full_name": "Residential Suburban"}, "eval_term": "min_lot_size", "llm_outputs": [{"place": {"town": "dobson", "district_short_name": "R-S", "district_full_name": "Residential Suburban"}, "eval_term": "min_lot_size", "raw_model_response": "Based on the information provided in the input, I could not find a specific min_lot_size value for the Residential Suburban (R-S) zoning district. The closest relevant information I found is:\n\n{\n    \"extracted_text\": [[\"Residential Suburban\\n30,000\\n20,000 (d)\", 53]],\n    \"rationale\": \"This table entry shows two different lot size requirements for the R-S (Residential Suburban) district, with a footnote (d) indicating the smaller size applies when public water or sewer is available.\",\n    \"answer\": \"30,000 sq ft; 20,000 sq ft if public water or sewer available\"\n}\n\nThe table on page 53 lists two different minimum lot sizes for the R-S district, depending on whether public utilities are available. However, without more context about which specific requirement applies, I've included both values in the answer.", "extracted_text": [["Residential Suburban\n30,000\n20,000 (d)", 53]], "rationale": "This table entry shows two different lot size requirements for the R-S (Residential Suburban) district, with a footnote (d) indicating the smaller size applies when public water or sewer is available.", "answer": "30,000 sq ft; 20,000 sq ft if public water or sewer available"}]}