{"place": {"town": "burlington", "district_short_name": "CBD", "district_full_name": "Central Business"}, "eval_term": "min_parking_spaces", "llm_outputs": [{"place": {"town": "burlington", "district_short_name": "CBD", "district_full_name": "Central Business"}, "eval_term": "min_parking_spaces", "raw_model_response": "Based on the provided input, I could not find any specific information about minimum parking space requirements for the Central Business (CBD) District. The input mentions that development in the CBD district is exempted from minimum off-street parking requirements, as stated in this excerpt:\n\n\"Development located in the CBD district is exempted from the minimum off-street parking requirements in Table 5.1.D.9, Table of Minimum Off-Street Parking Requirements, but any off-street parking spaces shall comply with the standards in Section 5.1.E, Parking Lot Configuration.\"\n\nSince the CBD district is exempt from minimum parking requirements, there is no specific value for min_parking_spaces that can be extracted for this zone. Therefore, I cannot provide a valid answer to the question about minimum parking spaces for the Central Business (CBD) District.\n\n{\n    \"extracted_text\": [[\"Development located in the CBD district is exempted from the minimum off-street parking requirements in Table 5.1.D.9, Table of Minimum Off-Street Parking Requirements, but any off-street parking spaces shall comply with the standards in Section 5.1.E, Parking Lot Configuration.\", 296]],\n    \"rationale\": \"The input explicitly states that the CBD district is exempt from minimum off-street parking requirements. Therefore, there is no specific minimum parking space requirement for this district.\",\n    \"answer\": null\n}", "extracted_text": [["Development located in the CBD district is exempted from the minimum off-street parking requirements in Table 5.1.D.9, Table of Minimum Off-Street Parking Requirements, but any off-street parking spaces shall comply with the standards in Section 5.1.E, Parking Lot Configuration.", 296]], "rationale": "The input explicitly states that the CBD district is exempt from minimum off-street parking requirements. Therefore, there is no specific minimum parking space requirement for this district.", "answer": null}]}