{"place": {"town": "beaufort", "district_short_name": "CS-MU", "district_full_name": "Cedar Street Mixed-Use"}, "eval_term": "min_lot_size", "llm_outputs": [{"place": {"town": "beaufort", "district_short_name": "CS-MU", "district_full_name": "Cedar Street Mixed-Use"}, "eval_term": "min_lot_size", "raw_model_response": "Based on the provided input, I could not find any specific information about the minimum lot size for the Cedar Street Mixed-Use (CS-MU) district. The relevant section on page 125 states:\n\n\"6) Minimum Lot Size.\nThe Cedar Street Mixed-Use Zoning District will not have a minimum lot size.\"\n\nTherefore, my response is:\n\n{\n    \"extracted_text\": [[\"6) Minimum Lot Size.\\nThe Cedar Street Mixed-Use Zoning District will not have a minimum lot size.\", 125]],\n    \"rationale\": \"The section explicitly states that there is no minimum lot size for the Cedar Street Mixed-Use Zoning District.\",\n    \"answer\": \"No minimum lot size\"\n}", "extracted_text": [["6) Minimum Lot Size.\nThe Cedar Street Mixed-Use Zoning District will not have a minimum lot size.", 125]], "rationale": "The section explicitly states that there is no minimum lot size for the Cedar Street Mixed-Use Zoning District.", "answer": "No minimum lot size"}]}