{"place": {"town": "charlotte", "district_short_name": "UMUD", "district_full_name": "Uptown Mixed Use District"}, "eval_term": "min_parking_spaces", "llm_outputs": [{"place": {"town": "charlotte", "district_short_name": "UMUD", "district_full_name": "Uptown Mixed Use District"}, "eval_term": "min_parking_spaces", "raw_model_response": "Based on the provided text, I could not find any specific information about minimum parking requirements for the Uptown Mixed Use District (UMUD). The closest relevant information I found is:\n\n{\n    \"extracted_text\": [[\"(c)\\nDwellings, all types: 1.0 space/unit\", 326]],\n    \"rationale\": \"This section specifies the parking requirement for dwellings in the Uptown Mixed Use District, which is the closest match to the requested information about minimum parking spaces.\",\n    \"answer\": \"1 per unit\"\n}\n\nThe text provides a parking requirement of 1 space per dwelling unit for all types of dwellings in the UMUD. While this is not specifically labeled as a minimum requirement, it appears to be the standard parking requirement for residential uses in this district.", "extracted_text": [["(c)\nDwellings, all types: 1.0 space/unit", 326]], "rationale": "This section specifies the parking requirement for dwellings in the Uptown Mixed Use District, which is the closest match to the requested information about minimum parking spaces.", "answer": "1 per unit"}]}