{"place": {"town": "beaufort", "district_short_name": "H-BD", "district_full_name": "Historic Business"}, "eval_term": "min_lot_size", "llm_outputs": [{"place": {"town": "beaufort", "district_short_name": "H-BD", "district_full_name": "Historic Business"}, "eval_term": "min_lot_size", "raw_model_response": "Based on the provided input, I could not find any specific information about the minimum lot size for the Historic Business District (H-BD). The relevant section about the H-BD zoning district states:\n\n\"1) Minimum Lot Size.\nThe H-BD district will not have a minimum lot size.\"\n\nTherefore, the correct response is:\n\n{\n    \"extracted_text\": [[\"1) Minimum Lot Size.\\nThe H-BD district will not have a minimum lot size.\", 131]],\n    \"rationale\": \"The section about the H-BD zoning district explicitly states that there is no minimum lot size requirement for this district.\",\n    \"answer\": \"No minimum lot size\"\n}", "extracted_text": [["1) Minimum Lot Size.\nThe H-BD district will not have a minimum lot size.", 131]], "rationale": "The section about the H-BD zoning district explicitly states that there is no minimum lot size requirement for this district.", "answer": "No minimum lot size"}]}