{"place": {"town": "carrboro", "district_short_name": "HR-R", "district_full_name": "Historic Rogers Road-Residential"}, "eval_term": "min_lot_size", "llm_outputs": [{"place": {"town": "carrboro", "district_short_name": "HR-R", "district_full_name": "Historic Rogers Road-Residential"}, "eval_term": "min_lot_size", "raw_model_response": "Based on the provided text, I could not find any specific information about the minimum lot size for the \"Historic Rogers Road-Residential\" (HR-R) zoning district. However, there is some relevant information that provides context:\n\n{\n    \"extracted_text\": [[\"The HR-R zoning district is designed to protect and preserve the character of existing lower-density areas (minimum lot size 14,520 square feet, or no more than three lots per acre) within the neighborhood while providing for compatible new development, including new housing choice options, and increased home occupation opportunities for residents.\", 6]],\n    \"rationale\": \"This passage describes the HR-R zoning district and mentions a minimum lot size, which corresponds to the min_lot_size we are looking for.\",\n    \"answer\": \"14,520 sq ft\"\n}", "extracted_text": [["The HR-R zoning district is designed to protect and preserve the character of existing lower-density areas (minimum lot size 14,520 square feet, or no more than three lots per acre) within the neighborhood while providing for compatible new development, including new housing choice options, and increased home occupation opportunities for residents.", 6]], "rationale": "This passage describes the HR-R zoning district and mentions a minimum lot size, which corresponds to the min_lot_size we are looking for.", "answer": "14,520 sq ft"}]}