{"place": {"town": "calabash", "district_short_name": "R-8", "district_full_name": "Residential"}, "eval_term": "min_unit_size", "llm_outputs": [{"place": {"town": "calabash", "district_short_name": "R-8", "district_full_name": "Residential"}, "eval_term": "min_unit_size", "raw_model_response": "Based on the provided information, I could not find a specific value for min_unit_size for single-family homes in the R-8 Residential District. The table on page 124 provides lot size and setback requirements for R-8, but does not specify a minimum unit size. The closest relevant information is:\n\n{\n    \"extracted_text\": [\n        [\"R-8\\nResidential District\\n8,000 for the first dwelling\\nunit, 4,000 for each additional\\ndwelling unit (calculated per\\nlot, not per building)\", 124]\n    ],\n    \"rationale\": \"This text specifies the minimum lot size for R-8, but does not provide a minimum unit size. The lot size requirement is not the same as a minimum unit or dwelling size.\",\n    \"answer\": null\n}", "extracted_text": [["R-8\nResidential District\n8,000 for the first dwelling\nunit, 4,000 for each additional\ndwelling unit (calculated per\nlot, not per building)", 124]], "rationale": "This text specifies the minimum lot size for R-8, but does not provide a minimum unit size. The lot size requirement is not the same as a minimum unit or dwelling size.", "answer": null}]}