{"place": {"town": "china-grove", "district_short_name": "C-B", "district_full_name": "C-B Central Business"}, "eval_term": "min_parking_spaces", "llm_outputs": [{"place": {"town": "china-grove", "district_short_name": "C-B", "district_full_name": "C-B Central Business"}, "eval_term": "min_parking_spaces", "raw_model_response": "Based on the provided input, I could not find any specific information about minimum parking spaces for the C-B Central Business District. The document mentions that there are no minimum parking requirements for any uses within the C-B District. Specifically, it states:\n\n\"C. No minimum parking requirements exist for any uses within the C-B District.\"\n\nTherefore, I cannot provide a specific value for min_parking_spaces for the C-B Central Business District.\n\n{\n    \"extracted_text\": [[\"C. No minimum parking requirements exist for any uses within the C-B District.\", 164]],\n    \"rationale\": \"The document explicitly states that there are no minimum parking requirements for any uses in the C-B (Central Business) District.\",\n    \"answer\": null\n}", "extracted_text": [["C. No minimum parking requirements exist for any uses within the C-B District.", 164]], "rationale": "The document explicitly states that there are no minimum parking requirements for any uses in the C-B (Central Business) District.", "answer": null}]}