{"place": {"town": "cedar-point", "district_short_name": "R-15", "district_full_name": "Residential"}, "eval_term": "min_lot_size", "llm_outputs": [{"place": {"town": "cedar-point", "district_short_name": "R-15", "district_full_name": "Residential"}, "eval_term": "min_lot_size", "raw_model_response": "Based on the provided input, here is the relevant information for the R-15 Residential District:\n\n{\n    \"extracted_text\": [\n        [\"A residential district requiring a minimum of 15,000 square feet per lot if public water or sewer is available.\", 49],\n        [\"A minimum lot area of fifteen thousand (15,000) square feet is required for all uses if public water or sewer is available. If public water or sewer is not available, a minimum lot area of twenty thousand (20,000) square feet shall be required.\", 50]\n    ],\n    \"rationale\": \"The R-15 Residential District section specifies the minimum lot size requirements, which vary depending on the availability of public water or sewer.\",\n    \"answer\": \"15,000 sq ft (if public water or sewer available); 20,000 sq ft (if no public water or sewer)\"\n}", "extracted_text": [["A residential district requiring a minimum of 15,000 square feet per lot if public water or sewer is available.", 49], ["A minimum lot area of fifteen thousand (15,000) square feet is required for all uses if public water or sewer is available. If public water or sewer is not available, a minimum lot area of twenty thousand (20,000) square feet shall be required.", 50]], "rationale": "The R-15 Residential District section specifies the minimum lot size requirements, which vary depending on the availability of public water or sewer.", "answer": "15,000 sq ft (if public water or sewer available); 20,000 sq ft (if no public water or sewer)"}]}