{"place": {"town": "carteret-county", "district_short_name": "B-1A", "district_full_name": "General Business"}, "eval_term": "max_height", "normalized_llm_outputs": [{"llm_output": {"place": {"town": "carteret-county", "district_short_name": "B-1A", "district_full_name": "General Business"}, "eval_term": "max_height", "raw_model_response": "Based on the provided input, there is no specific information about the maximum height for the General Business (B-1A) zoning district. The table in the input shows dimensional requirements for various zoning districts, but the row for B-1A only specifies:\n\nCELL (28, 1): B-1A (General Business District)\nCELL (28, 2): 1 acre\nCELL (28, 3): 80\nCELL (28, 4): 40\nCELL (28, 5): 20ab\nCELL (28, 6): 10ab\nCELL (28, 7): 15\nCELL (28, 8): 50\n\nThe last column (CELL 28, 8) shows a value of 50, which likely corresponds to the maximum height in feet for the B-1A district. Therefore, I can provide the following response:\n\n{\n    \"extracted_text\": [[\"CELL (28, 8): 50\", 59]],\n    \"rationale\": \"The table of dimensional requirements shows a value of 50 in the height column for the B-1A (General Business) district.\",\n    \"answer\": \"50 ft\"\n}", "extracted_text": [["CELL (28, 8): 50", 59]], "rationale": "The table of dimensional requirements shows a value of 50 in the height column for the B-1A (General Business) district.", "answer": "50 ft"}, "normalized_answer": ["50"]}]}