{"place": {"town": "blowing-rock", "district_short_name": "TC", "district_full_name": "Town Center"}, "eval_term": "max_height", "normalized_llm_outputs": [{"llm_output": {"place": {"town": "blowing-rock", "district_short_name": "TC", "district_full_name": "Town Center"}, "eval_term": "max_height", "raw_model_response": "Based on the input text, here is the relevant information about the max_height for the Town Center (TC) district:\n\n{\n    \"extracted_text\": [[\"The maximum building height shall be limited to 30 feet, as measured from the average elevation of the existing or proposed sidewalk along the primary street to the highest point of the building or structure\", 129]],\n    \"rationale\": \"This section explicitly states the maximum building height for the Town Center district.\",\n    \"answer\": \"30 ft\"\n}\n\nThe text provides clear information about the maximum building height in the Town Center district, stating it is limited to 30 feet measured from the sidewalk to the highest point of the building. This directly answers the question about max_height for the TC district.", "extracted_text": [["The maximum building height shall be limited to 30 feet, as measured from the average elevation of the existing or proposed sidewalk along the primary street to the highest point of the building or structure", 129]], "rationale": "This section explicitly states the maximum building height for the Town Center district.", "answer": "30 ft"}, "normalized_answer": ["30"]}]}