{"place": {"town": "edgecombe-county", "district_short_name": "AR-30", "district_full_name": "Rural Residential"}, "eval_term": "max_height", "normalized_llm_outputs": [{"llm_output": {"place": {"town": "edgecombe-county", "district_short_name": "AR-30", "district_full_name": "Rural Residential"}, "eval_term": "max_height", "raw_model_response": "Based on the information provided, I could not find a specific maximum height value for the Rural Residential (AR-30) district. The dimensional requirements table on page 166 shows the following for maximum building height in the AR-30 district:\n\n\"Maximum Building Height (feet)\nResidential Development: 35\nNon-Residential Use: 35\"\n\nTherefore, the answer for the maximum height in the Rural Residential (AR-30) district is:\n\n{\n    \"extracted_text\": [[\"Maximum Building Height (feet)\\nResidential Development: 35\\nNon-Residential Use: 35\", 166]],\n    \"rationale\": \"The dimensional requirements table for the AR-30 district explicitly states the maximum building height for both residential and non-residential uses.\",\n    \"answer\": \"35 ft\"\n}", "extracted_text": [["Maximum Building Height (feet)\nResidential Development: 35\nNon-Residential Use: 35", 166]], "rationale": "The dimensional requirements table for the AR-30 district explicitly states the maximum building height for both residential and non-residential uses.", "answer": "35 ft"}, "normalized_answer": ["35"]}]}