{"place": {"town": "atlantic-beach", "district_short_name": "MHI", "district_full_name": "Mixed Use High Intensity"}, "eval_term": "max_height", "normalized_llm_outputs": [{"llm_output": {"place": {"town": "atlantic-beach", "district_short_name": "MHI", "district_full_name": "Mixed Use High Intensity"}, "eval_term": "max_height", "raw_model_response": "Based on the information provided in the input, here is the relevant extracted text and answer regarding the maximum height for the Mixed Use High Intensity (MHI) district:\n\n{\n    \"extracted_text\": [[\"Maximum Height (feet)\\n55 [6]\", 109]],\n    \"rationale\": \"The table of dimensional standards for the MHI district explicitly states the maximum height requirement.\",\n    \"answer\": \"55 ft\"\n}\n\nThe table on page 109 lists the dimensional standards for the Mixed Use High Intensity (MHI) district, including a \"Maximum Height\" requirement of 55 feet. There is a footnote [6] which states \"Single-family and duplex dwellings shall have a maximum height of 45 feet.\" However, since we are interested in the overall maximum height for the MHI district, not just for single-family homes, the correct answer is 55 feet.", "extracted_text": [["Maximum Height (feet)\n55 [6]", 109]], "rationale": "The table of dimensional standards for the MHI district explicitly states the maximum height requirement.", "answer": "55 ft"}, "normalized_answer": ["55"]}]}