{"place": {"town": "carteret-county", "district_short_name": "I-W", "district_full_name": "Industrial and Wholesale"}, "eval_term": "max_height", "normalized_llm_outputs": [{"llm_output": {"place": {"town": "carteret-county", "district_short_name": "I-W", "district_full_name": "Industrial and Wholesale"}, "eval_term": "max_height", "raw_model_response": "Based on the information provided in the input text, here is the relevant information about the maximum height for the Industrial and Wholesale (I-W) zoning district:\n\n{\n    \"extracted_text\": [[\"I-W (Industrial and Wholesale District)\\n1 acre\\n100\\n50\\n30abc\\n20abc\\n30\\n60d\", 59],\n                       [\"d = 110' for drystack boat storage.\", 60]],\n    \"rationale\": \"The table on page 59 lists the dimensional requirements for different zoning districts, including I-W (Industrial and Wholesale District). It shows a maximum height of 60 feet for this district, with a footnote 'd'. The footnote on page 60 indicates that for drystack boat storage, the maximum height is 110 feet.\",\n    \"answer\": \"60 ft (110 ft for drystack boat storage)\"\n}", "extracted_text": [["I-W (Industrial and Wholesale District)\n1 acre\n100\n50\n30abc\n20abc\n30\n60d", 59], ["d = 110' for drystack boat storage.", 60]], "rationale": "The table on page 59 lists the dimensional requirements for different zoning districts, including I-W (Industrial and Wholesale District). It shows a maximum height of 60 feet for this district, with a footnote 'd'. The footnote on page 60 indicates that for drystack boat storage, the maximum height is 110 feet.", "answer": "60 ft (110 ft for drystack boat storage)"}, "normalized_answer": ["60", "110"]}]}