{"place": {"town": "beaufort", "district_short_name": "CS-MU", "district_full_name": "Cedar Street Mixed-Use"}, "eval_term": "min_parking_spaces", "normalized_llm_outputs": [{"llm_output": {"place": {"town": "beaufort", "district_short_name": "CS-MU", "district_full_name": "Cedar Street Mixed-Use"}, "eval_term": "min_parking_spaces", "raw_model_response": "Based on the provided input, I could not find any specific information about minimum parking spaces for the Cedar Street Mixed-Use (CS-MU) zoning district. However, I did find some relevant parking requirements for this district:\n\n{\n    \"extracted_text\": [[\"h) Parking Requirements.\\ni)\\nMixed use, multi-family and single-family lots shall provide 1.5 onsite parking\\nspaces/unit;\\nii)\\nCommercial lots with an area less than 5000 ft2 have no requirements for onsite\\nparking; and,\\niii)\\nCommercial lots with an area more than 5000 ft2 shall provide 1 onsite parking\\nspace for every 600 ft2 of gross floor area.\", 125]],\n    \"rationale\": \"The text provides specific parking requirements for the Cedar Street Mixed-Use (CS-MU) zoning district, including requirements for residential and commercial uses.\",\n    \"answer\": \"1.5 per unit for residential; 1 per 600 sq ft for commercial over 5000 sq ft\"\n}", "extracted_text": [["h) Parking Requirements.\ni)\nMixed use, multi-family and single-family lots shall provide 1.5 onsite parking\nspaces/unit;\nii)\nCommercial lots with an area less than 5000 ft2 have no requirements for onsite\nparking; and,\niii)\nCommercial lots with an area more than 5000 ft2 shall provide 1 onsite parking\nspace for every 600 ft2 of gross floor area.", 125]], "rationale": "The text provides specific parking requirements for the Cedar Street Mixed-Use (CS-MU) zoning district, including requirements for residential and commercial uses.", "answer": "1.5 per unit for residential; 1 per 600 sq ft for commercial over 5000 sq ft"}, "normalized_answer": ["1.5", "1", "600", "5000"]}]}