{"place": {"town": "cedar-point", "district_short_name": "I-W", "district_full_name": "Industrial and Wholesale"}, "eval_term": "min_lot_size", "normalized_llm_outputs": [{"llm_output": {"place": {"town": "cedar-point", "district_short_name": "I-W", "district_full_name": "Industrial and Wholesale"}, "eval_term": "min_lot_size", "raw_model_response": "Based on the provided input, here is the relevant information for the Industrial and Wholesale (I-W) zoning district:\n\n{\n    \"extracted_text\": [\n        [\"Minimum lot area necessary of one (1) acre is required for all uses.\", 68],\n        [\"Minimum lot width shall be one hundred (100) feet.\", 68],\n        [\"Minimum depth of the front yard shall be fifty (50) feet.\", 68],\n        [\"Minimum depth of the side yard shall be twenty (20) feet. In case of a corner\\nlot or a lot that is adjacent to a residential zone or use, to ensure adequate\\nsight clearance, the minimum width of the side yard adjacent to the right-\\nof-way or residential zone or use shall be no less than thirty (30) feet.\", 68],\n        [\"Minimum depth of the rear yard shall be thirty (30) feet.\", 68]\n    ],\n    \"rationale\": \"The section for the I-W Industrial and Wholesale District provides dimensional requirements, including the minimum lot area of one acre (43,560 sq ft) for all uses.\",\n    \"answer\": \"1 acre\"\n}", "extracted_text": [["Minimum lot area necessary of one (1) acre is required for all uses.", 68], ["Minimum lot width shall be one hundred (100) feet.", 68], ["Minimum depth of the front yard shall be fifty (50) feet.", 68], ["Minimum depth of the side yard shall be twenty (20) feet. In case of a corner\nlot or a lot that is adjacent to a residential zone or use, to ensure adequate\nsight clearance, the minimum width of the side yard adjacent to the right-\nof-way or residential zone or use shall be no less than thirty (30) feet.", 68], ["Minimum depth of the rear yard shall be thirty (30) feet.", 68]], "rationale": "The section for the I-W Industrial and Wholesale District provides dimensional requirements, including the minimum lot area of one acre (43,560 sq ft) for all uses.", "answer": "1 acre"}, "normalized_answer": ["1"]}]}