{"place": {"town": "atlantic-beach", "district_short_name": "CIR", "district_full_name": "Commercial Circle"}, "eval_term": "min_parking_spaces", "normalized_llm_outputs": [{"llm_output": {"place": {"town": "atlantic-beach", "district_short_name": "CIR", "district_full_name": "Commercial Circle"}, "eval_term": "min_parking_spaces", "raw_model_response": "Here is my attempt at extracting the relevant information about minimum parking spaces for the Commercial Circle (CIR) zoning district:\n\n{\n    \"extracted_text\": [[\"Parking spaces shall be provided at a ratio of one (1) space per each three hundred (300) square feet of gross floor area for commercial or office space and one and one-half (1 1/2) spaces per residential dwelling unit or hotel room.\", 125]],\n    \"rationale\": \"This text specifically mentions the parking requirements for the CIR district, including for commercial, office, and residential uses.\",\n    \"answer\": \"1 per 300 sq ft for commercial/office, 1.5 per dwelling unit or hotel room\"\n}", "extracted_text": [["Parking spaces shall be provided at a ratio of one (1) space per each three hundred (300) square feet of gross floor area for commercial or office space and one and one-half (1 1/2) spaces per residential dwelling unit or hotel room.", 125]], "rationale": "This text specifically mentions the parking requirements for the CIR district, including for commercial, office, and residential uses.", "answer": "1 per 300 sq ft for commercial/office, 1.5 per dwelling unit or hotel room"}, "normalized_answer": ["1", "300", "1.5"]}]}