{"place": {"town": "chadbourn", "district_short_name": "CIV", "district_full_name": "Civic"}, "eval_term": "min_lot_size", "normalized_llm_outputs": [{"llm_output": {"place": {"town": "chadbourn", "district_short_name": "CIV", "district_full_name": "Civic"}, "eval_term": "min_lot_size", "raw_model_response": "Based on the provided input, I could not find any specific information about the minimum lot size for the Civic (CIV) zoning district. The closest relevant information I found was:\n\n{\n    \"extracted_text\": [[\"CELL (2, 1): \\n20,000 SF\", 146]],\n    \"rationale\": \"This table provides dimensional standards for the Civic District, including a minimum lot size. However, it's not explicitly labeled as 'min_lot_size', so we should be cautious about assuming this is the definitive answer.\",\n    \"answer\": \"20,000 sq ft\"\n}\n\nWhile this appears to be the minimum lot size for the Civic District, I want to emphasize that it's not explicitly labeled as such, so there's a possibility it could refer to something else. The context suggests this is likely the minimum lot size, but without more explicit confirmation, we should treat this answer with some caution.", "extracted_text": [["CELL (2, 1): \n20,000 SF", 146]], "rationale": "This table provides dimensional standards for the Civic District, including a minimum lot size. However, it's not explicitly labeled as 'min_lot_size', so we should be cautious about assuming this is the definitive answer.", "answer": "20,000 sq ft"}, "normalized_answer": ["20000"]}]}