{"place": {"town": "chapel-hill", "district_short_name": "R-2", "district_full_name": "Residential"}, "eval_term": "min_parking_spaces", "normalized_llm_outputs": [{"llm_output": {"place": {"town": "chapel-hill", "district_short_name": "R-2", "district_full_name": "Residential"}, "eval_term": "min_parking_spaces", "raw_model_response": "Based on the dimensional matrix provided, here are the relevant details for the Residential (R-2) zoning district:\n\n{\n    \"extracted_text\": [[\"CELL (9, 1): R-2\\nCELL (9, 2): 10,000\\nCELL (9, 3): 52\\nCELL (9, 4): 65\\nCELL (9, 5): 29\\nCELL (9, 6): 50\\nCELL (9, 7): 26\\nCELL (9, 8): 11\\nCELL (9, 9): 13\\nCELL (9, 10): .5/.7\\nCELL (9, 11): .093\\nCELL (9, 12): N/A\", 44]],\n    \"rationale\": \"The R-2 zoning district row in the dimensional matrix contains the parking requirements. Column J shows the maximum impervious surface ratio, which is often related to parking requirements.\",\n    \"answer\": \"0.5 for single-family/two-family, 0.7 for multi-family/non-residential\"\n}", "extracted_text": [["CELL (9, 1): R-2\nCELL (9, 2): 10,000\nCELL (9, 3): 52\nCELL (9, 4): 65\nCELL (9, 5): 29\nCELL (9, 6): 50\nCELL (9, 7): 26\nCELL (9, 8): 11\nCELL (9, 9): 13\nCELL (9, 10): .5/.7\nCELL (9, 11): .093\nCELL (9, 12): N/A", 44]], "rationale": "The R-2 zoning district row in the dimensional matrix contains the parking requirements. Column J shows the maximum impervious surface ratio, which is often related to parking requirements.", "answer": "0.5 for single-family/two-family, 0.7 for multi-family/non-residential"}, "normalized_answer": ["0.5", "0.7"]}]}