{"place": {"town": "belhaven", "district_short_name": "R-5", "district_full_name": "Residential"}, "eval_term": "min_lot_size", "normalized_llm_outputs": [{"llm_output": {"place": {"town": "belhaven", "district_short_name": "R-5", "district_full_name": "Residential"}, "eval_term": "min_lot_size", "raw_model_response": "Based on the provided text, here is the relevant information for the Residential (R-5) zoning district:\n\n{\n    \"extracted_text\": [\n        [\"CELL (2, 1): R5\\nCELL (2, 2): All Uses\\nCELL (2, 3): 5,000\\nCELL (2, 4): 50 ft.\", 11]\n    ],\n    \"rationale\": \"The table on page 11 provides the dimensional requirements for the R-5 district. It specifies the minimum square feet per building lot for all uses in the R-5 district.\",\n    \"answer\": \"5,000 sq ft\"\n}\n\nThe table clearly shows that for the R-5 district, the minimum square feet per building lot for all uses is 5,000 sq ft. This corresponds to the min_lot_size we are looking for.", "extracted_text": [["CELL (2, 1): R5\nCELL (2, 2): All Uses\nCELL (2, 3): 5,000\nCELL (2, 4): 50 ft.", 11]], "rationale": "The table on page 11 provides the dimensional requirements for the R-5 district. It specifies the minimum square feet per building lot for all uses in the R-5 district.", "answer": "5,000 sq ft"}, "normalized_answer": ["5000"]}]}