{"place": {"town": "bladenboro", "district_short_name": "N-B", "district_full_name": "Neighborhood Business"}, "eval_term": "min_lot_size", "normalized_llm_outputs": [{"llm_output": {"place": {"town": "bladenboro", "district_short_name": "N-B", "district_full_name": "Neighborhood Business"}, "eval_term": "min_lot_size", "raw_model_response": "Based on the provided input, I could not find any specific information about the minimum lot size for the Neighborhood Business (N-B) district. The relevant section for the N-B district is on page 216, but it states that the minimum lot area is \"Not Specified\". Therefore, I cannot provide a definitive answer for the min_lot_size of the N-B district.\n\n{\n    \"extracted_text\": [[\"CELL (2, 1): \\nMinimum Lot Area in\\nSquare Feet\\nCELL (2, 2): \\nNot Specified\", 216]],\n    \"rationale\": \"The table on page 216 provides dimensional standards for the Neighborhood Business (N-B) district. For the 'Minimum Lot Area in Square Feet' requirement, it states 'Not Specified'.\",\n    \"answer\": null\n}", "extracted_text": [["CELL (2, 1): \nMinimum Lot Area in\nSquare Feet\nCELL (2, 2): \nNot Specified", 216]], "rationale": "The table on page 216 provides dimensional standards for the Neighborhood Business (N-B) district. For the 'Minimum Lot Area in Square Feet' requirement, it states 'Not Specified'.", "answer": null}, "normalized_answer": null}]}