{"place": {"town": "coats", "district_short_name": "RMST", "district_full_name": "Residential Main Street Transition"}, "eval_term": "min_lot_size", "normalized_llm_outputs": [{"llm_output": {"place": {"town": "coats", "district_short_name": "RMST", "district_full_name": "Residential Main Street Transition"}, "eval_term": "min_lot_size", "raw_model_response": "Based on the information provided, there is no specific minimum lot size mentioned for the Residential Main Street Transition (RMST) district. The closest relevant information I could find is:\n\n{\n    \"extracted_text\": [[\"Minimum\\nLot Size\\n5000 SF\\nfor all\\ntypes\\nexcept\\nSingle-\\nfamily\\nAttached\\nTownhouse\\nat 1600 SF\", 142]],\n    \"rationale\": \"This table provides minimum lot size requirements for the RMST district. It specifies 5000 sq ft for all types except single-family attached townhouses, which have a 1600 sq ft minimum.\",\n    \"answer\": \"5000 sq ft (except 1600 sq ft for single-family attached townhouses)\"\n}", "extracted_text": [["Minimum\nLot Size\n5000 SF\nfor all\ntypes\nexcept\nSingle-\nfamily\nAttached\nTownhouse\nat 1600 SF", 142]], "rationale": "This table provides minimum lot size requirements for the RMST district. It specifies 5000 sq ft for all types except single-family attached townhouses, which have a 1600 sq ft minimum.", "answer": "5000 sq ft (except 1600 sq ft for single-family attached townhouses)"}, "normalized_answer": ["5000", "1600"]}]}