{"place": {"town": "bethel", "district_short_name": "RA-20", "district_full_name": "Residential Agricultural"}, "eval_term": "min_lot_size", "normalized_llm_outputs": [{"llm_output": {"place": {"town": "bethel", "district_short_name": "RA-20", "district_full_name": "Residential Agricultural"}, "eval_term": "min_lot_size", "raw_model_response": "Based on the input provided, I could not find a specific value for the minimum lot size (min_lot_size) for the RA-20 Residential/Agricultural Zone. However, the document does provide some relevant information about lot size requirements for this zone:\n\n{\n    \"extracted_text\": [[\"The minimum building site area shall be one lot or parcel of land 20,000 square feet in area for each main building. Such parcel of land shall have an average width of at least 100 feet.\", 13]],\n    \"rationale\": \"This section specifies the minimum lot size requirement for the RA-20 Residential/Agricultural Zone.\",\n    \"answer\": \"20,000 sq ft\"\n}\n\nThe text clearly states that the minimum building site area for the RA-20 zone is 20,000 square feet, which corresponds to the min_lot_size we are looking for. The answer is provided in square feet, which matches the requested format.", "extracted_text": [["The minimum building site area shall be one lot or parcel of land 20,000 square feet in area for each main building. Such parcel of land shall have an average width of at least 100 feet.", 13]], "rationale": "This section specifies the minimum lot size requirement for the RA-20 Residential/Agricultural Zone.", "answer": "20,000 sq ft"}, "normalized_answer": ["20000"]}]}