{"place": {"town": "coats", "district_short_name": "MU-2", "district_full_name": "Mixed Use"}, "eval_term": "min_lot_size", "normalized_llm_outputs": [{"llm_output": {"place": {"town": "coats", "district_short_name": "MU-2", "district_full_name": "Mixed Use"}, "eval_term": "min_lot_size", "raw_model_response": "Based on the provided input, there is no specific information about the minimum lot size for a \"Mixed Use (MU-2)\" zone. The document does mention MU-1 and MU-2 zones, but it does not provide a specific minimum lot size for MU-2. The closest relevant information is:\n\n{\n    \"extracted_text\": [[\"6,000 SF\\nfor all\\ntypes\\nexcept\\nSingle-\\nfamily\\nAttached\\nTownhouse\\nat 1600 SF\", 147]],\n    \"rationale\": \"This table provides minimum lot sizes for Mixed Use Districts (MU-1 and MU-2), but it's a general value for all types except Single-family Attached Townhouses. It's not specific to MU-2 alone.\",\n    \"answer\": \"6,000 sq ft (for all types except Single-family Attached Townhouse at 1600 sq ft)\"\n}", "extracted_text": [["6,000 SF\nfor all\ntypes\nexcept\nSingle-\nfamily\nAttached\nTownhouse\nat 1600 SF", 147]], "rationale": "This table provides minimum lot sizes for Mixed Use Districts (MU-1 and MU-2), but it's a general value for all types except Single-family Attached Townhouses. It's not specific to MU-2 alone.", "answer": "6,000 sq ft (for all types except Single-family Attached Townhouse at 1600 sq ft)"}, "normalized_answer": ["6000", "1600"]}]}