{"place": {"town": "pilot-mountain", "district_short_name": "RA", "district_full_name": "Residential-Agricultural"}, "eval_term": "min_lot_size", "normalized_llm_outputs": [{"llm_output": {"place": {"town": "pilot-mountain", "district_short_name": "RA", "district_full_name": "Residential-Agricultural"}, "eval_term": "min_lot_size", "raw_model_response": "Based on the information provided, here is my analysis for the min_lot_size requirement for the Residential-Agricultural (RA) zoning district:\n\n{\n    \"extracted_text\": [\n        [\"RA, Residential - Agricultural\", 55],\n        [\"Without either public\\nwater or sewer\", 55],\n        [\"30,000\", 55],\n        [\"With public water\", 55],\n        [\"20,000\", 55],\n        [\"With public water and\\nsewer\", 56],\n        [\"20,000\", 56]\n    ],\n    \"rationale\": \"The table on pages 55-56 provides minimum lot size requirements for the RA (Residential-Agricultural) district. The requirements vary based on the availability of public water and sewer services.\",\n    \"answer\": \"30,000 sq ft (without public water or sewer); 20,000 sq ft (with public water or with both public water and sewer)\"\n}", "extracted_text": [["RA, Residential - Agricultural", 55], ["Without either public\nwater or sewer", 55], ["30,000", 55], ["With public water", 55], ["20,000", 55], ["With public water and\nsewer", 56], ["20,000", 56]], "rationale": "The table on pages 55-56 provides minimum lot size requirements for the RA (Residential-Agricultural) district. The requirements vary based on the availability of public water and sewer services.", "answer": "30,000 sq ft (without public water or sewer); 20,000 sq ft (with public water or with both public water and sewer)"}, "normalized_answer": ["30000", "20000"]}]}