{"place": {"town": "coats", "district_short_name": "MU-1", "district_full_name": "Mixed Use"}, "eval_term": "min_lot_size", "normalized_llm_outputs": [{"llm_output": {"place": {"town": "coats", "district_short_name": "MU-1", "district_full_name": "Mixed Use"}, "eval_term": "min_lot_size", "raw_model_response": "Based on the provided input, there is no specific information about the minimum lot size for a \"Mixed Use (MU-1)\" zoning district. The document does mention MU-1 and MU-2 districts, but it does not provide a clear minimum lot size for MU-1. The closest relevant information is:\n\n{\n    \"extracted_text\": [[\"Minimum\\nLot Size\", 147], [\"6,000 SF\\nfor all\\ntypes\\nexcept\\nSingle-\\nfamily\\nAttached\\nTownhouse\\nat 1600 SF\", 147]],\n    \"rationale\": \"This table provides minimum lot size information for Mixed Use Districts (MU-1 and MU-2), but it's not specific to MU-1. It gives a general minimum lot size for most types in these districts.\",\n    \"answer\": \"6,000 sq ft (for most types); 1,600 sq ft (for Single-family Attached Townhouse)\"\n}", "extracted_text": [["Minimum\nLot Size", 147], ["6,000 SF\nfor all\ntypes\nexcept\nSingle-\nfamily\nAttached\nTownhouse\nat 1600 SF", 147]], "rationale": "This table provides minimum lot size information for Mixed Use Districts (MU-1 and MU-2), but it's not specific to MU-1. It gives a general minimum lot size for most types in these districts.", "answer": "6,000 sq ft (for most types); 1,600 sq ft (for Single-family Attached Townhouse)"}, "normalized_answer": ["6000", "1600"]}]}